,Title,Content,Url
0,I 5 PARCHI PIU’ VERDI DI VERONA CITTA’,"I 5 PARCHI PIU’ VERDI DI VERONA CITTA’ 

Stanchi dello smog della città? Nessun problema.. la nostra città è ricca anche di zone verdi!
Ve ne indichiamo alcune..

Il Parco dell’Adige a poche centinaia di metri dal cuore della città. Si estende in un’area verde incontaminata tra Porto San Pancrazio e Cà del Bue dal quale è possibile arrivare a Zevio con la pista ciclabile. Perfetto per tranquille passeggiate domenicali, è stato riconosciuto nel 2005 come “Area naturale protetta di interesse locale”, lo sapevi?
Il Parco San Giacomo, un’area verde situata nel quartiere di Borgo Roma a Verona Sud, ricca di percorsi e sentieri per coloro che amano le passeggiate ma anche ottima per praticare sport grazie all’attrezzatura per allenamenti all’aria aperta.
Il Parco delle Colombare (in foto) parco storico della città situato sulle Torricelle, offre una splendida vista panoramica su Verona, accessibile anche ai vostri amici a quattro zampe.
Il Lazzaretto nel quartiere di Porto San Pancrazio, progettato dall’architetto Michele Sanmicheli e completato nel 1628. Il suo nome proviene dall’utilizzo che ne veniva fatto a quei tempi, infatti, durante l’epidemia, era il luogo di ricovero e reclusione dei malati di peste. Divenuto poi deposito di materiale bellico, oggi rimangono le sue rovine in un’area verde ed è comunque facilmente visitabile.
Per ultimo ma non ultimo, il Parco delle Mura e dei Forti nelle vicinanze della stazione Verona Porta Nuova che segue la forma delle mura di cinta difensive dette “Bastioni” e delle fortificazioni delle città ed offre dei percorsi storici suggestivi.

Quale di questi visiterai per primo?
",https://www.visitverona.net/i-5-parchi-piu-verdi-di-verona-citta/
1,LE 4 MIGLIORI PASSEGGIATE DA FARE A VERONA,"LE 4 MIGLIORI PASSEGGIATE DA FARE A VERONA 

Oltre alla classica passeggiata per le vie del centro di Verona, vi proponiamo anche dei percorsi alternativi semplici e adatti a tutti ma altrettanto gradevoli per scoprire la città da un punto di vista diverso!

Una passeggiata rilassante nel Lungadige Attiraglio, il percorso ciclopedonale che costeggia il fiume Adige ed ha una lunghezza di circa 5 km. Ideale anche per una corsetta!
Il percorso Benessere lungo “La Vecchia Ferrovia” situato tra i quartieri di Santa Lucia e delle Golosine, chiamato così per la presenza dei vecchi binari del raccordo ferroviario in disuso. Si tratta di una pista ciclo-pedonale molto frequentata dai cittadini veronesi soprattutto nelle ore di punta. Potrete recarvi in quest’area verde con la famiglia o con i bambini e il passeggino.
Il Parco delle Mura e dei Forti di Verona, percorso lungo circa 9 km che può essere portato a termine in mezza giornata!
Passeggiata lungo le mura di Verona a San Zeno in Monte, inizia da Porta Vescovo e arriva alla Chiesa di San Zeno in Monte. Lungo complessivamente 850 metri è ottimo per una passeggiata all’aria aperta! A circa metà del percorso incontrerete il Parco Alto San Nazaro ricco di verde.
",https://www.visitverona.net/le-4-migliori-passeggiate-da-fare-a-verona/
2,LE 5 ATTRAZIONI DEI MERCATINI DI NATALE,"LE 5 ATTRAZIONI DEI MERCATINI DI NATALE 

I Mercatini di Natale a Verona sono un must assolutamente da non perdere. Le lucine colorate, il profumo di dolci tipici e vin brulè, l’atmosfera Natalizia che si respira passeggiando per le vie del centro, rendono Verona ancora più suggestiva e romantica. Ma quali le attrazioni da non perdere?
Ecco qui le cinque tappe da non perdere nel vostro tour dei mercatini di natale:
TAPPA NUMERO 1
La prima attività che vi consigliamo da fare in coppia, o con i vostri amici e famiglie è assolutamente pattinare sul ghiaccio nella Pista della Winter Area allestita in Piazza Sacco e Vanzetti, ai piedi dell’Arsenale.
Un’attività divertente sia per i più grandi che per i più piccini. Potrete pattinare con Castelvecchio sullo sfondo, in una cornice suggestiva della città di Verona. Sempre nella stessa area sarà presente anche un piccolo villaggio di Natale con cioccolate calde e dolci per riscaldarvi.
TAPPA NUMERO 2
Se avete bambini non potete perdervi una visita alla Casa di Babbo Natale. Quale modo migliore per fargli vivere la magia del Natale?
Troverete l’iconica casetta in legno illuminata e allestita accanto alla Loggia Fra Giocondo nel Cortile del Tribunale.
TAPPA NUMERO 3
Cosa sono i Mercatini di Natale senza le prelibatezze natalizie?!
La sosta in Piazza dei Signori è d’obbligo, per scaldarvi con una deliziosa cioccolata calda o del vin brulè, accompagnata da Bretzel salati e dolci o altri piatti tipici tedeschi e locali.
Ma le sorprese dolci non finiscono qua…dal 10 al 13 dicembre potrete trovare in Piazza Brà, ai piedi dell’Arena, i coloratissimi banchetti di Santa Lucia, colmi di dolciumi e prodotti di artigianato, perfetti per fare qualche piccolo regalo da mettere sotto l’albero.
TAPPA NUMERO 4
Siete amanti del Natale e dei presepi? Allora rimanete in piazza Brà e vivete la magia con la mostra I Presepi dal Mondo.
La Mostra è nel Guinness dei primati, con i suoi 400 presepi provenienti da tutto il mondo, in uno spazio espositivo allestito nel maestoso Palazzo della Gran Guardia, proprio di fronte all’Arena di Verona.
TAPPA 5
Ultimo ma non meno importante vi consigliamo di partecipare alla famosa Corsa dei Babbi Natale, la Melegatti Christmas Run il 18 Dicembre!
Si tratta di un percorso di 5 km tra le suggestive mura e monumenti di Verona, in cui vestiti da Babbo Natale, si sfila insieme condividendo un momento emozionante, brindando al Natale e al nuovo anno.
",https://www.visitverona.net/le-5-attrazioni-dei-mercatini-di-natale/
3,INAUGURAZIONE MERCATINI DI NATALE A VERONA 2022,"INAUGURAZIONE MERCATINI DI NATALE A VERONA 2022 

Oggi sabato 19 Novembre 2022 è stata inaugurata la quattordicesima edizione dei Mercatini di Natale a Verona. L’apertura sancita con l’iconico taglio del nastro, alle ore 11:30 nella celebre via della Costa in Piazza Erbe, da parte dell’assessore all’attività economica del comune di Verona Italo Sandrini.
Presenti per l’occasione anche l’eurodeputato Paolo Borchia, la senatrice Aurora Floridia, i deputati Marco Padovani, Flavio Tosi e Matteo Gelmetti, i consiglieri regionali Enrico Corsi e Alberto Bozza, il presidente della provincia Manuel Scalzotto, il consigliere comunale del Comune di Verona Nicolò Zavarise, il presidente della Confcommercio Paola Arena, il presidente della Confesercenti Paolo Bissoli, i vice presidenti di Confesercenti Alex Camara e Fabio Ferrari, il Direttore di Confesercenti Alessandro Torluccio.
Presente per la promozione della manifestazione tutto il team Verona Social, responsabile della comunicazione dei Mercatini di Natale a Verona e Don Ambrogio, il famoso prete di Tiktok.
I Mercatini di Verona rimarranno aperti, come da tradizione, fino al 26 Dicembre.
Anche quest’anno i Mercatini di Natale a Verona sono associati con gli omonimi mercatini di Norimberga, i Christkindlmarkt.
Oltre 100 espositori, con le tipiche casette di legno, decorano la città di Verona e creando un’atmosfera fiabesca.
I luoghi dove recarsi per poter visitare i Mercatini sono: Piazza dei Signori, Cortile Mercato Vecchio, Cortile del Tribunale, Loggia del Cortile del Tribunale, Via della Costa, Loggia Vecchia e Piazza Sacco e Vanzetti (Arsenale).
Gli orari di questa edizione sono:
Dalla domenica al giovedì dalle 11 alle 21,
Il venerdì e il sabato dalle 10 alle 23,
08 Dicembre dalle 10 alle 23,
24 Dicembre dalle 10 alle 17,
25 Dicembre dalle 16 alle 23,
26 Dicembre dalle 11 alle 18.
La manifestazione gode della co-organizzazione del Comune di Verona e del patrocinio di numerosi enti tra cui Regione del Veneto, Provincia di Verona, Confesercenti e Confcommercio Verona.
Vi aspettiamo nei Mercatini di Natale più magici di sempre!
",https://www.visitverona.net/inaugurazione-mercatini-di-natale-a-verona-2022/
4,VERONA MARATHON,"SCOPRI CON NOI LA 21ESIMA EDIZIONE DELL’EVENTO SPORTIVO PIU’ IMPORTANTE DI
VERONA! 
Manca pochissimo alla partenza della ventunesima edizione della Verona Marathon con i suoi 3 imperdibili appuntamenti: la Hoka Verona Marathon da 42Km, la Zero Wind Cangrande Half Marathon di 21Km e l’ Avesani Last 10Km.
Oltre 7 mila i runner e gli atleti pronti a partecipare da tutta Italia e non solo, con la voglia di condividere le emozioni dello sport correndo tra le suggestive mura di Verona.
Moltissimi i motivi per partecipare e correre la Verona Marathon: dalla bellezza dei tre percorsi, completamente chiusi al traffico e interamente pianeggianti, alla spettacolare partenza e arrivo nella splendida cornice di Piazza Brà sotto gli occhi dell’Arena, alla possibilità anche per chi assiste, di godere dei meravigliosi panorami che Verona ci regala e dei monumenti patrimonio dell’Unesco. Proprio perché lo sport è di tutti, l’iniziativa della Last 10Km Marathon consente anche a famiglie e bambini di partecipare, per una giornata emozionante, all’insegna della condivisione.
La Verona Marathon è un appuntamento non solo di sport ma anche di solidarietà ed etica sociale che abbraccia diversi progetti a scopo benefico, noi ve ne raccontiamo uno in particolare: la storia dell’infermiere e atleta Matteo Berton e della sua associazione Onlus Il Filo Continuo. Ogni anno, da 5 anni, Matteo Berton corre la Maratona nella città di Giulietta e Romeo insieme ad un ragazzo in carrozzina, per una raccolta fondi a sostegno del progetto Giardino Inclusivo, che si impegna a creare degli spazi verdi facilmente accessibili da persone con disabilità, per il miglioramento della loro qualità di vita.
Noi di Verona Social abbiamo a cuore questa causa e se anche tu vuoi contribuire alla creazione di un’oasi verde dedicata al coinvolgimento dei disabili in tante più attività di inclusione e condivisione visita il link e partecipa alla donazione: https://www.retedeldono.it/iniziative/filo-continuo/matteo.berton/corri-con-noi
",https://www.visitverona.net/verona-marathon/
5,5 PIATTI TIPICI VERONESI DA NON PERDERE,"Uno dei tanti modi per scoprire un luogo è mangiare piatti tipici del territorio. Vivere un luogo, capirlo, scoprirlo significa anche provare i sapori che lo caratterizzano e che tanto sono amati dai locali. Ecco perché vogliamo assolutamente consigliarvi 5 piatti tipici della tradizione veronese da assaggiare durante la vostra visita a Verona. 

1- Risotto all’Amarone

Grazie al suo sapore delizioso, questo risotto cucinato con il pregiato vino della Valpolicella è uno dei piatti preferiti dai residenti e dai visitatori della città. Viene preparato con ingredienti che provengono esclusivamente dalla zona veronese: il riso Vialone Nano, l’Amarone della Valpolicella ed il formaggio Monte Veronese grattugiato.

2 – Risotto al Tastasal

Piatto tipico della cucina veronese, e del Veneto, questo risotto è fatto di carne di maiale macinata, salata e pepata. Il significato della parola “tastasal” è proprio “assaggiare il sale” in dialetto veneto, e infatti questa ricetta veniva preparata per controllare che la carne usata per le salsicce ed i salami, fosse salata propriamente. Molto popolare nelle cucine dei veronesi, ne esistono varie versioni, tutte ugualmente deliziose.

3 – Lesso e Pearà

Tra i piatti tipici di Verona, uno dei più conosciuti è il Lesso con la Pearà, cioè un bollito di carne e verdure servito con una purea di pane grattuggiato insaporita da abbondante pepe. Sembra un piatto umile e povero ma dietro in realtà c’è una storia regale.. Si narra che il primo a cucinare l’iconica salsa, fu il cuoco di corte di Alboino, re dei Longobardi, per la regina, che straziata dal dolore era caduta in depressione con l’intenzione di lasciarsi morire di fame. Grazie a questa speciale salsa dalle grandi proprietà e gusto, la regina riprende forza e vigore, e da allora il piatto diventa iconico e tradizionale Veronese.

4 – Pastissada de Caval

Secondo antichi racconti la ricetta per questo famoso piatto tipico Veronese ha delle precise origini storiche. Al termine della battaglia combattuta tra il Re d’Italia Odoacre ed il Re degli Ostrogoti Teodorico, rimasero sul terreno migliaia di cavalli, che il popolo stremato dalla fame fu autorizzato a recuperare per far provvista. Per disporre a lungo della grande quantità di carne, questa venne tagliata e lasciata macerare nel vino rosso, con dovizia di spezie e verdure. La successiva cottura a fuoco lento portò alla scoperta di questo squisito piatto, la cui ricetta tramandata di generazione in generazione è arrivata fino ai nostri giorni.

5 – Torta delle rose

In classifica vi proponiamo anche questo dolce della tradizione Veronese. La soffice Torta Delle Rose è uno splendido dolce tipico, composto da sfoglie di pasta a forma di boccioli di rosa morbidi e burrosi. Dalle origini Veronesi, si narra sia nata in onore della Regina Margherita. Un lievitato di tradizione perfetto in ogni occasione, assolutamente da provare
",https://www.visitverona.net/5-piatti-tipici-veronesi-da-non-perdere/
6,Le 10 location più instagrammabili di Verona,"Gli amanti della fotografia e gli instagramers hanno una predilezione per scattare cartoline dei luoghi più belli che poi diventano virali. Noi comuni mortali ci chiediamo “ma sarà bello come in foto?”. La curiosità suscitata da questi scatti mozzafiato ha fatto da spinta alla crescita del cosiddetto turismo da social: il cercare la location instagrammabile, l’angolatura migliore ed il momento perfetto per scattare foto da sogno…
Perché un viaggio non è lo stesso senza qualche foto ricordo.
E allora abbiamo pensato a voi, con questa piccola guida alle 10 location più instagrammabili di Verona, pronta all’uso. 

1 – PANORAMA DA CASTEL SAN PIETRO

Vedere il tramonto più spettacolare di Verona non ha prezzo. Basta solo salire i gradini di fronte a Ponte Pietra, e al fianco del Teatro Romano, per poter ammirare il panorama di tutta la città che spunta da dietro i cipressi, custodi di Castel San Pietro. Nel piazzale panoramico ogni angolo è splendido per una foto perfetta di Verona, che con quei colori pazzeschi lì, vi sembrerà un dipinto!

2 – ARENA DI VERONA

Il simbolo di Verona: la millenaria Arena è certamente l’edificio più ammirato e fotografato della città, sia da dentro che dalla bellissima Piazza Brà che la cinge e la esalta. Per uno scorcio super Instagrammabile vi suggeriamo di camminare dalla Piazza verso Via Mazzini, troverete quindi una scultura a forma di cuore, più precisamente una panchina. Si tratta dell’installazione artistica “Forever Love” che riporta anche le iniziali di Giulietta e Romeo, direi perfetta per una pic romantica su uno dei monumenti più imponenti di Verona.

3 – PIAZZA ERBE

Il cuore pulsante di Verona: la lunga e stretta Piazza delle Erbe è una meraviglia da ammirare! Era il Foro della Verona romana: quindi sono 2000 anni che si tiene il mercato qui; prima solo della verdura (da qui il nome), ora di tutto. Le sue bancarelle, i palazzi medievali e gli affreschi, la splendida fontana centrale e le colonne veneziane sullo sfondo sono perfette per fare foto meravigliose! 

4 – VISTA SU PIAZZA ERBE DALLA TORRE DEI LAMBERTI

Dall’alto dell’edificio più alto di Verona, con i suoi 368 gradini, si ha una vista pazzesca su tutta Verona. La Torre dei Lamberti è assolutamente un posto imperdibile per una foto mozzafiato. Sotto si può ammirare Piazza delle Erbe, elegantissima da questo punto di vista, e che durante i mercatini natalizi, regala una visuale davvero singolare: le bancarelle vengono sistemate a forma di cuore.. Più instagrammabile di così!!!

5 – BALCONE DI GIULIETTA

L’altro simbolo di Verona è Casa di Giulietta! Il celebre balcone di questo piccolo cortile in via Cappello è super instagrammabile da ogni punto di vista. Direttamente dal cortile, salendo sul balcone o da una terrazza superiore per una vista panoramica su tutto il cortile, insomma sbizzarritevi!!

6 – GIARDINO GIUSTI

Un angolo verde nascosto di Verona, dove la città diventa natura. Il Giardino Giusti è un meraviglioso giardino che merita assolutamente un posto nelle Top location instagrammabili. Vi sembrerà un pò di essere come Alice nel paese delle meraviglie tra vialetti, statue, labirinti e grotte. E salendo nella parte più alta, oltrepassando un giardino all’inglese, potrete fotografare un incredibile scorcio della città. 

7- VIA SOTTORIVA

La via più bella di tutta Verona, la più autentica, romantica, suggestiva, con un’aria un pò vintage e anche instagrammabile. Insomma passateci e fateci sapere se anche a voi viene voglia di comprare una macchina fotografica. La parte migliore per Instagram? Sotto i Portici.

8 – PONTE SCALIGERO

Basta entrare nel cortile e percorrere il ponte, salendo i gradini sui lati per ammirare fantastici scorci di Verona tra le merlature in mattoni che fungono da cornice ideale per una foto perfetta. La sera poi, con le luci della città che si accendono e il cielo che sfiora tutte le tonalità di blu, è davvero uno spettacolo!

9 – CASTELVECCHIO

Si può accedere ai camminamenti esterni panoramici del Castello attraverso il suo museo civico interno. La vista ne vale davvero la pena! Percorri i suoi stretti corridoi sospesi per avere una meravigliosa vista sul Ponte Scaligero e sull’Adige.

10 – PONTE PIETRA

La passeggiata su Ponte Pietra è una delle cose assolutamente irrinunciabili per chi visita Verona. E’ di una bellezza senza tempo da qualsiasi lato lo si guardi. Sullo sfondo destro si ammirano le meravigliose case colorate e piene di verde che si affacciano sull’Adige, cornice perfetta per una foto indimenticabile. Per poter godere di una visuale ancora più suggestiva vi suggeriamo di attraversare il ponte, con il centro di Verona alle spalle, e di scendere le scalinate che vi condurranno sulla riva dell’Adige. Da qui potrete scattare una foto meravigliosa.
",https://www.visitverona.net/le-10-location-piu-instagrammabili-di-verona/
7,I 5 Migliori Pokè di Verona,"Il Poke o la Poke, che sia maschile o femminile non ne siamo sicuri, quello che è certo è quanto sia perfetta come idea di pausa pranzo o anche come cena fast quando non abbiamo voglia di cucinare. E allora vi consigliamo i 5 migliori locali di Verona dove potrete trovare degli ingredienti pazzeschi per un momento Pokè speciale.

1- POKE HOUSE

In pieno centro storico a Verona, tra Castelvecchio e Porta Borsari, puoi prenderti una pausa in questo coloratissimo locale dallo stile Californiano. Una tentazione sana e gustosa a cui puoi cedere per fare il pieno di energia.
Puoi scegliere la Pokè Bowl che preferisci, tra quelle proposte o comporla tu con gli ingredienti che più ti ispirano. Il risultato? Un pranzo super colorato, sano ed equilibrato. Anche gluten free!

2 – POKE SCUSE

In corso Portanuova, a due passi da Piazza Brà, troverete il creativo locale Poke Scuse, non potrete non notarlo, le luci e l’arredamento vi inviteranno ad entrare e accomodarvi per godervi la vostra pausa pranzo con un Pokè squisito.
Anche in questo locale potrai scegliere di comporre la tua bowl o scegliere una delle proposte sul menù. Una sosta assolutamente da fare!!

3 – POKE GARDAEN

A due passi dal centro città trovate questa piccola oasi verde in cui potrete scegliere se consumare in loco la vostra Pokè o scegliere il servizio di asporto. Il locale è all’insegna della natura, infatti l’80% delle piante che lo arredano sono curate giornalmente dallo staff, regalando questa piacevole atmosfera healty. Lo sono anche i loro ingredienti per le Pokè bowl. Un menù molto interessante, assolutamente da provare!

4 – MACHA CAFE’

Potrete trovare questo locale all’interno del centro commerciale Adigeo. Una location molto graziosa in stile giapponese, all’insegna dell’healty food. Qui potrete trovare svariate proposte, dalle Bowls con gli ingredienti a vostra scelta a comporre la Pokè, a Pancakes salati e colorati, a Burger di ogni tipo fino ai dolcetti e altre sfiziosità.

5 – HAWAII POKE

In ultimo vi consigliamo questo locale, situato nel lungadige in zona Universitaria, molto frequentato dagli studenti. Il locale è davvero piccolo, non ci sono posti a sedere per la consumazione in loco perciò vi consigliamo di sceglierlo nel caso in cui vogliate un goloso Pokè da asporto. La qualità degli ingredienti è buona come anche le dimensioni e la quantità, insomma se avete parecchia fame è perfetto!
",https://www.visitverona.net/i-5-migliori-poke-di-verona/
8,I 4 Rooftop Panoramici di Verona,"Sogni un Aperitivo al tramonto con vista sulle meraviglie di Verona?
Guardare la città da una prospettiva diversa la rende ancora più affascinante, e Verona vista dall’alto, con un tramonto mozzafiato che fa da sfondo e un buon cocktail in mano vi regalerà un momento indimenticabile.
Abbiamo selezionato qui per voi le 4 più scenografiche terrazze con vista su Verona, in cui godersi un momento di relax, per un‘esperienza unica.

TERRAZZA ARENA SKYLOUNGE

Al quinto piano dell’Hotel Milano & SPA, a due passi dall’Arena, troverete questo stupendo rooftop, una terrazza spettacolare con vista panoramica sull’Arena illuminata, e osservare lo skyline di Verona. Un’esperienza unica e indimenticabile. Potrete degustare un cocktail tra le proposte del sapiente barman o qualche calice di champagne.

TERRAZZA HOTEL DUE TORRI

Il Due Torri Hotel offre la possibilità anche ad ospiti esterni di godere della propria terrazza panoramica, la Gourmet Grill Restaurant, uno spazio di 300 mq sospesi a circa 30 metri da terra, a due passi da Sant’Anastasia. Una vista spettacolare che spazia dalla Torre dei Lamberti al Duomo, dal Castel San Pietro alle Torricelle, fino alle dolci curve e le acque del Fiume Adige.
Al Gourmet Grill Restaurant potrete degustare un aperitivo al tramonto o decidere di regalarvi una cena con vista. Uno spettacolo.

RE TEODORICO

Salendo i gradini da Teatro Romano fino a Castel San Pietro potrete trovare questo romantico locale con vista mozzafiato sull’Adige.
Re Teodorico è l’incontro tra cucina italiana moderna e una location da sogno: un giardino panoramico per ammirare Verona dall’alto concedendosi una pausa culinaria. Il locale offre un’ampia scelta di proposte, dalla caffetteria, al wine e cocktail bar, fino a pizzeria ed altri piatti dello chef.

VISTA PALAZZO

Puoi goderti la città di Shakespeare a 360 gradi da dove non l’hai mai vista. Accomodati sul terrazzo dell’Infinity Bar del 5 Stelle Superior Vista Palazzo. Ti sembrerà di essere in un’oasi verde in pieno centro a Verona, un ambiente di charme ma riservato.
Regalati un’esperienza chic provando uno dei cocktail presenti nella selezione della Signature List: uno spettacolo di gusti e sapori per ogni tipo di palato.
Chiudi gli occhi e sogna.
",https://www.visitverona.net/i-4-rooftop-panoramici-di-verona/
