,Title,Content,Url
138,I MIGLIORI PUNTI PANORAMICI A VERONA,"I MIGLIORI PUNTI PANORAMICI A VERONA 
DOVE POTER AMMIRARE LA CITTÀ DALL’ALTO

Verona è considerata una delle città più belle d’Italia, ma da dove possiamo ammirarla nella sua forma migliore? Famosa per i suoi numerosi punti panoramici, la città è ancora più bella se vista dall’alto. I suoi tetti, chiese, campanili, e il corso del fiume Adige creano uno spettacolo unico nel suo genere. Noi di VisitVerona.Net abbiamo raccolto alcuni suggerimenti per farvi godere una vista eccezionale sulla città. Perfette per un appuntamento romantico, per un’uscita con gli amici e anche per un momento con se stessi, questi luoghi vi mostreranno una città diversa dal solito. Salvate questitips sui migliori punti panoramici a Verona e condivideteli con i vostri amici!

3 LOCATION PER INNAMORARVI DI VERONA
1| CASTEL SAN PIETRO

Proprio dietro al Teatro Romano si eleva Colle San Pietro. La sua cima è raggiungibile a piedi o tramite funicolare. Lì si erge il Castello di San Pietro, un antico edificio militare. Da questo punto panoramico si può ammirare la bellezza della città scaligera in tutte le sue sfumature. Questa cornice sulla città è amata dai turisti ma soprattutto dai veronesi. La nostra preferita? Sicuramente al tramonto, quando la luce dorata del sole si riflette sulla superficie del fiume Adige.
CASTEL SAN PIETRO

2| TORRE DEI LAMBERTI

Con 84 metri di altezza la Torre dei Lamberti regala a tutti coloro che scelgono di salire fino alla sua cima una vista davvero impareggiabile. Fu costruita nel 1172 per volere della famiglia Lamberti, fu poi danneggiata da un fulmine nel 1403 e ricostruita nel 1448, ma solo altri 15 anni dopo fu completata e raggiunse la sua attuale altezza. Accessibile tutti i giorni dell’anno ad eccezione del 25 dicembre, all’interno della torre si possono contare ben 368 scalini, in alternativa è disponibile anche un ascensore per raggiungere la sua cima. Famosa per il panorama, questa torre vi lascerà senza fiato. Cliccate qui per prenotare il vostroingresso!
TORRE DEI LAMBERTI

3| TERRAZZA DI PALAZZO MAFFEI

Il palazzo occupa il lato nord di Piazza delle Erbe e al suo interno si trova una casa museo che appare come un vero e proprio scrigno d’arte. All’interno del palazzo potrete ammirare più di 200 dipinti, 20 sculture e 100 disegni. La terrazza panoramica si trova in cima al palazzo. Qui potete trovare sei statue che rappresentano, partendo da sinistra: Ercole, Giove, Venere, Apollo, Mercurio e Minerva, le più importanti divinità della Grecia antica. Dopo aver attraversato la caratteristica scala a chiocciola a forma elicoidale potrete ammirare il cuore della città dall’alto, ne resterete meravigliati! Cliccate qui per comprare il vostro ticket!
PALAZZO MAFFEI
E voi conoscete altre location che offrono viste mozzafiato?
Taggateci sui nostri profili social @veronasocialofficial e @visitveronaofficial nelle vostre stories e post di Instagram e Facebook per condividere i vostri panorami!
Godetevi la vista! 
",https://www.visitverona.net/i-migliori-punti-panoramici-di-verona/
139,COSA VISITARE GRATUITAMENTE A VERONA?,"COSA VISITARE GRATUITAMENTE A VERONA? 
LE LOCATION DA NON PERDERSI IN CITTÀ 

Dalle piazze ai ponti più antichi, dalle biblioteche agli spazi verdi, sono moltissime le attività da fare a Verona gratuitamente. Noi di VisitVerona.net abbiamo selezionato per voi alcune location non a pagamento che dovete assolutamente conoscere. Se volete scoprire cosa visitare gratuitamente a Verona, questi suggerimenti fanno sicuramente al caso vostro! Salvate questi consigli e inviateli ai vostri amici prima della vostra visita low-cost a Verona!

5 LUOGHI GRATIS DA SCOPRIRE
1I PIAZZALE CASTEL SAN PIETRO

Il piazzale è il punto panoramico del Colle di San Pietro, che offre ai visitatori un panorama spettacolare sulla città. Questa location, raggiungibile tramite funivia o gratuitamente tramite una scalinata di fronte a Ponte Pietra, sovrasta il Teatro Romano e permette di osservare il corso del fiume Adige che racchiude interamente il centro storico ad impianto romano. Voi ci siete mai stati?
VISTA DA CASTEL SAN PIETRO

2I VIA MAZZINI

Una delle vie più famose dell’intera città, via Mazzini è considerata la “via della moda” veronese. Questa via infatti comprende molti negozi di abbigliamento e non solo. Unisce le due principali piazze di Verona e vanta di un fascino unico; qui si può davvero respirare l’atmosfera veronese. Avete già fatto shopping in questa celebre via?
VIA MAZZINI

3I CORTILE MERCATO VECCHIO E SCALA DELLA RAGIONE

Nascosto nel cuore di Verona potete trovare un piccolo ma affascinante spazio che oggi è utilizzato per manifestazioni culturali ed enogastronomiche. Da qui vi circonda il Palazzo della Ragione, oggi sede della Galleria d’Arte Moderna Achille Forti, e la splendida Scala della Ragione. Questo luogo magico si trova proprio dietro Piazza Erbe, lo conoscevate?
SCALA DELLA RAGIONE

4I VIA SOTTORIVA

Questa via iconica di Verona prende il nome dal fatto che era solitamente una delle prime vie della città ad essere colpita dalle inondazioni del fiume Adige. Questa si trova infatti in una posizione più bassa rispetto al Lungadige Donatelli. Sui muri delle sue case sono ancora visibili i segni del livello raggiunto dal fiume nel corso della devastante alluvione del 1882. Colorata da diversi bar e ristoranti questa via è fiancheggiata da un porticato tipico, avete già attraversato questa zona particolare di Verona?
VIA SOTTORIVA

5I CORTE SGARZERIE

Un angolo della città in cui regna la pace assoluta: Corte Sgarzerie. Qui ai tempi del Medioevo si trovava il cuore pulsante della lavorazione e commercio della lana, infatti era considerato il punto di ritrovo di artigiani e commercianti del settore. Troverete nella piazzetta una grande loggia del Mangano, e a lato della corte dei piccoli portici, qui si effettuavano le operazioni di pesatura, analisi qualità e marchiatura della lana nelle varie fasi del processo produttivo. Il nome “sgarzaria” viene proprio dalla parola in dialetto veronese sgarzar che indica la cardatura della lana. Lo sapevate?
E voi conoscete altre location da scoprire gratuitamente in questa città magica?
Taggateci sui nostri profili social @veronasocialofficial e @visitveronaofficial nelle vostre stories e post di Instagram e Facebook condividendo con noi queste ed altre meraviglie!
Buon divertimento! 
",https://www.visitverona.net/cosa-visitare-gratuitamente-a-verona/
140,I POSTI PIÙ INSTAGRAMMABILI DI VERONA,"I POSTI PIÙ INSTAGRAMMABILI DI VERONA 
COSA FOTOGRAFARE IN CITTÀ?

Verona è una città capace di sorprendere sempre i suoi visitatori, sia dal vivo che catturata in foto. Se avete in programma una gita in questa splendida città e volete scattare delle foto per i vostri profili social segnatevi queste location: non solo vi faranno battere il cuore, ma staranno benissimo sul vostro feed! Noi di VisitVerona.net in questo blog vi aiuteremo a scoprire i posti più inaspettati e rappresentativi della città scaligera. Siete pronti a sfoderare i vostri cellulari? Inizia la caccia ai posti più instagrammabili di Verona!

LOCATION INASPETTATE PER SCATTARE FOTO
1 I PANCHINA A CUORE

Uno dei luoghi più comuni ma anche uno dei più iconici da fotografare di Verona è la panchina a forma di cuore di fronte all’Arena. La cosiddetta “panchina dell’amore” si chiama ufficialmente “forever love” ed è costruita in acciaio e legno. L’opera è stata donata alla città da due artisti e designer friulani, Stefano e Francesco Borella. Questa panchina viene immortalata ogni giorno da moltissimi turisti, che la riconoscono come un luogo must di Verona. Curiosità: il cuore è composto dall’unione delle due iniziali di Giulietta e Romeo, l’avete mai notato? Situata all’imbocco di via Mazzini, non potete fare a meno di passare da qui per la prima delle vostre foto instagam-approved.

2 I GIARDINO GIUSTI

Questo giardino magico vi farà sentire come in una fiaba. Al suo interno troverete una combinazione unica di natura, arte e storia. Le opportunità di scattare foto aesthetic sono davvero molte, ecco i nostri consigli: attraverso una torretta con una scala nascosta, si potrà accedere a un giardino superiore, da cui la vista panoramica è davvero spettacolare. Inoltre, nel giardino è presente uno tra i labirinti più antichi d’Europa, qui una foto è d’obbligo! Statue mitologiche, fontane, grotte, reperti romani, vasi con agrumi e viali di cipressi saranno il soggetto perfetto per il vostro feed di Instagram. Altre informazioni sul loro sito.
GIARDINO GIUSTI

3 I ALBERO GIALLO

Si chiama ufficialmente Ginkgo Biloba ed è considerato l’albero giapponese dei miracoli, infatti si dice che abbia numerose proprietà curative. Questa specie è diventata famosa per essere emblema di resistenza e rinascita, per questo motivo la città di Tokyo l’ha scelta come simbolo. La sua particolarità? Le sue foglie verde chiaro si tingono in autunno di un giallo davvero brillante. A Verona ne potete trovare uno in Piazza Indipendenza. Con o senza foglie gialle, è uno spettacolo che non potete perdervi!
ALBERO GIALLO

4 I BIBLIOTECA CAPITOLARE

La biblioteca capitolare è la biblioteca più antica al mondo ancora in attività. Al suo interno troverete una collezione di oltre 1200 manoscritti, tra cui numerose opere uniche al mondo. Qui l’atmosfera è unica, grazie alle luci soffuse ed agli scaffali in legno scuro. Questo luogo che sembra fuori dal tempo conserva testi riferibili alle più svariate discipline: teologia, diritto, poesia, filosofia, astronomia, medicina, botanica, storia e numerose altre. Trovi qui tutte le altre informazioni, scatenate la vostra creatività con degli scatti inaspettati e misteriosi!
BIBLIOTECA CAPITOLARE

5 I BOTTE A CUORE

Bardolino è un comune a 30 km da Verona famoso per accogliere ogni anno moltissimi turisti. Due tappe da visitare assolutamente in questa zona sono il centro storico, un concentrato di bellezza e colori, e il suo porto pittoresco. Al termine del lungolago, che offre una vista unica specialmente al tramonto, potrete incontrare il simbolo per eccellenza di Bardolino. Stiamo parlando di una botte con all’interno un’apertura a forma di cuore, una cornice perfetta per le vostre foto del lago! Conoscevate già questo “spot”?
BOTTE A CUORE

6 I VIA TRE MARCHETTI

Questo piccolo vicolo a qualche passo dall’Arena è poco conosciuto ma vi saprà sicuramente sorprendere. Questa location, perfetta per gli amanti degli scorci più caratteristici e particolari, mostra un lato più tradizionale e quieto della città dell’amore. Il nostro consiglio è di fotografarlo al calare del sole, per catturare tutto il fascino dei suoi colori aranciati. Con molta probabilità il nome “Tre Marchetti” fa riferimento alla moneta spicciola utilizzata a Verona a partire dalla fine del Quattrocento, ci andrete?

7 I GIARDINO DELLA GIOIELLERIA PIÙ PICCOLA DEL MONDO

La gioielleria più piccola del mondo si trova proprio a Verona, in Corso Porta Borsari. Sul retro del locale, grande solo 3,78 metri quadrati, si apre l’antico chiostro con il suo giardino segreto. In questo luogo regna una vegetazione rigogliosa e un’atmosfera davvero avvolgente: scattare qualche foto sarà obbligatorio. Qui potrete ammirare altre opere di gioielleria: lasciatevi trasportare dalla bellezza di questa perla segreta.
GIOIELLERIA PORTA BORSARI

8 I VICOLO BOTTE

Vicolo Botte è un piccolo spiazzopoco lontano da Castel San Pietro da cui è possibile assistere agli spettacoli del Teatro Romano. Da qui si ha accesso ad una visuale di una bellezza unica: è infatti possibile ammirare l’antico Teatro, l’Adige, Castel San Pietro e la chiesa dei Santi Siro e Libera. Questa location romantica e caratteristica è perfetta per terminare in bellezza il vostro tour di foto.
Conoscete altri luoghi per catturare immagini di questa città straordinaria?
Taggateci sui nostri profili social @veronasocialofficial e @visitveronaofficial nelle vostre stories e post di Instagram e Facebook per condividere i vostri contenuti su Verona!
Buon post! 
",https://www.visitverona.net/i-posti-piu-instagrammabili-di-verona/
141,GITA FUORI PORTA NEL VERONESE? 5 ESPERIENZE,"GITA FUORI PORTA NEL VERONESE? 5 ESPERIENZE 

5 ESCURSIONI ALLA SCOPERTA DELLA PROVINCIA DI VERONA

Le gite fuori porta sono sempre un’ottima occasione per conoscere meglio il territorio e la sua cultura, le curiosità meno conosciute e i luoghi di interesse nascosti più suggestivi.
Le bellezze di Verona non si trovano solo nel centro storico: ci sono tante località affascinanti da scoprire disseminate in tutta la provincia. Quali? Noi di VisitVerona.net abbiamo selezionato 5 esperienze per immergersi nella natura ed esplorare le zone limitrofe di Verona, da ammirare da una prospettiva tutta nuova.

5 CONSIGLI PER UNA GIORNATA NELLA NATURA NEI DINTORNI DI VERONA
1 | LA VALLE DELLE SFINGI IN LESSINIA

Immersa nel Parco Naturale Regionale della Lessinia, è chiamata “Valle delle Sfingi” per la presenza di rocce monolitiche le cui forme ricordano le sfingi egizie, modellate così per l’erosione della superficie nel corso del tempo. L’atmosfera è pittoresca e affascinante.
Passeggiare tra queste sculture naturali è un’esperienza unica, piacevole da fare ogni momento dell’anno. La Valle è facilmente raggiungibile con una passeggiata di bassa difficoltà dal paesino di Camposilvano, a Velo Veronese.
LA VALLE DELLE SFINGI

2 | FUNIVIA MALCESINE PER MONTE BALDO

La Funivia Malcesine per Monte Baldo offre un’esperienza mozzafiato tra cielo e terra. Situata a Malcesine, sulle rive del Lago di Garda, questa moderna funivia ti solleva dolcemente verso le vette del Monte Baldo, regalando panorami straordinari lungo il percorso. A bordo della cabina panoramica girevole a 1800 metri di altezza, sarai avvolto da una magnifica sensazione di libertà.
La Funivia Malcesine Monte Baldo è aperta tutti i giorni dalle 8:15 alle 18:00.
L’ultimo rientro è previsto alle 18:45.
Funivia Malcesine per Monte Baldo 
Via Navene Vecchia, 12, 37018 Malcesine VR
Tel. 045 740 0206
FUNIVIA MALCESINE

3 | MUSEO DEI FOSSILI E CAVA DELLA PESCIARA

Inaugurato nel 1996, il Museo dei fossili di Bolca permette di fare un’ideale “passeggiata Paleontologica” alla scoperta di flora, fauna e rocce vulcaniche e sedimentarie del Monte Postale e della Pesciara, in un vero e proprio tuffo nel passato di 50 milioni di anni fa.
Nel giacimento de La Pesciara si possono ammirare fossili di pesci e piante conservati all’interno della cava, tutti da scoprire grazie alla possibilità di setacciare la terra. Un’esperienza diversa e molto divertente per grandi e piccini che vogliono avventurarsi nella storia della località di Bolca.
Museo dei Fossili di Bolca
Via San Giovanni Battista 37030 Bolca di Vestenanova (VR)
Tel. 333 4653861
MUSEO DEI FOSSILI E CAVA DELLA PESCIARA

4 | PERCORSO DEI 10 CAPITELLI A SOAVE

L’itinerario dei 10 Capitelli costituisce un interessante percorso di circa 10 chilometri che si snoda tra le dolci colline circostanti Soave e Monteforte d’Alpone. Passeggiando con calma ci si impiega all’incirca 3 ore, ma la gratificazione è immensa grazie allo spettacolare panorama circostante.
Il punto di partenza è Monteforte d’Alpone, con il primo capitello raffigurante la Madonna con Gesù. Il percorso è chiaramente segnalato da cartelli gialli o marroni lungo tutto il tragitto, rendendo l’avventura agevole e di facile intuizione.
PERCORSO DEI 10 CAPITELLI

5 | PONTE DI VEJA A SANT’ANNA D’ALFAEDO

Il Ponte di Veja costituisce un imponente arco naturale di roccia, risultato della caduta interna di una vasta grotta carsica, avvenuta circa 40 milioni di anni fa a causa dell’incessante erosione delle acque. Il ponte ha un’altezza di circa 50 metri e una larghezza di 10.
La meraviglia di questo luogo può essere ammirata sia dalla zona sottostante, che offre prospettive affascinanti, sia attraverso una passeggiata sopra l’arco stesso.
Lungo il percorso sono presenti tabelle informative per scoprire numerose curiosità, come un elenco dei diversi reperti rinvenuti: punte di frecce, aghi, utensili e resti ossei di creature preistoriche. Questi offrono una testimonianza di inestimabile importanza per la ricostruzione delle vicende storiche del territorio.
Ponte Veja
Località Ponte di Veja, Sant’Anna d’Alfaedo VR
PONTE DI VEJA
Hai mai fatto una di queste escursioni? Taggaci sui nostri profili social @veronasocialofficial e @visitveronaofficial nelle tue stories e post di Instagram e Facebook se ci sarete!
Buona gita! 
",https://www.visitverona.net/gita-fuori-porta-nel-veronese-5-idee-imperdibili/
142,5 ESPERIENZE DA FARE PER UN SAN VALENTINO PERFETTO A VERONA,"5 ESPERIENZE DA FARE PER UN SAN VALENTINO PERFETTO A VERONA 

Cupido e le sue frecce volano tra le vie di Verona

La CITTA’ DELL’AMORE più romantica d’Italia per antonomasia si corona di rosso nel periodo più romantico dell’anno. Meta d’eccellenza delle anime gemelle di tutto il mondo, è perfetta per celebrare il giorno degli innamorati.
Chi non riconosce a Romeo e Giulietta di Shakespeare il titolo di coppia più famosa della storia? 
Verona, la loro patria, non è solo casa di una storia tragica quanto affascinante, è anche un luogo magico dove condividere con la propria dolce metà le emozioni di una passeggiata al tramonto, una cena a lume di candela o un viaggio da ricordare per la vita.
Sappiamo tutti che non è facile scegliere tra le tante opportunità che la nostra bella città offre, per questo vi elencheremo le migliori, secondo noi, da fare in coppia almeno una volta nella vita.
Innanzitutto non potete non attraversare mano nella mano le vie storiche di Verona e passare per i monumenti principali!
Ma ecco qui dei consigli per delle ESPERIENZE indimenticabili:

Consigliamo di raggiungere Piazza delle Erbe e di salire sulla Torre dei Lamberti che, per l’occasione, si colora di rosso, per godere insieme di una vista mozzafiato sulla città di Verona e su Piazza dei Signori. Non perdete l’occasione di partecipare all’Aperintorre in Love organizzato nella terrazza della Torre, acquistando il biglietto vi garantirete un aperitivo romantico nella più alta di Verona.
Da Piazza dei Signori potrete poi partecipare all’evento “Verona in Love” organizzato dal Comune di Verona. Dal 10 al 14 febbraio 2023 verrà offerto un programma ricco di appuntamenti tra visite guidate, la mezza maratona e gametour segreti. La stessa piazza vedrà esposte numerose bancarelle disposte a forma di cuore. I mercatini offriranno degustazioni di prodotti tipici, idee regalo e manufatti artistici dedicati all’amore. Regalatevi a vicenda un bacio al sapore di cioccolato, un dolcetto ispirato a Romeo e Giulietta, ovvero, un morbido e friabile biscotto a forma di cuore e a base di nocciole e mandorle.
Virtual Dinner per due al ristorante Tre Marchetti nei pressi dell’Arena, rimarrete sorpresi nel vedere i piatti e il tavolo che prendono vita. Uno spettacolo realizzato attraverso il videomapping e la realtà aumentata che mostra disegni di ogni genere oppure le mani dello chef mentre preparano il piatto che sta per essere servito. Esperienza assolutamente da provare. MAGGIORI INFO QUI 

Chi passa di fronte all’imponente Arena di Verona deve assolutamente avere una foto di coppia nella propria galleria con uno sfondo senza tempo. Inoltre, vi segnaliamo l’iniziativa della Fondazione Arena per un regalo esclusivo al vostro/a partner, potrete infatti acquistare due open ticket con una riduzione del 50%  SCOPRITE DI PIU’ QUI. Per la sera, prenotate in uno dei ristoranti di Piazza Bra una cena per due a lume di candela, non ve ne pentirete! Un altro must have è la foto nel cortile della casa di Giulietta, sotto il suo balcone o con la sua riproduzione!
Dormire al Relais Balcone di Giulietta e risvegliarsi come la celebre Giulietta Capuleti. Situato nel cortile dove affaccia il balcone più famoso al mondo nel centro storico della città, sarete i padroni di casa per una notte. Maggiori info qui

Per coronare la serata, visitate il Pozzo dell’Amore edesprimete insieme un desiderio.
E VOI SEGUIRETE I NOSTRI CONSIGLI E TRASCORRETE IL SAN VALENTINO A VERONA? 
TAGGATECI NELLE VOSTRE FOTO SU INSTAGRAM SE LO FARETE menzionando @veronasocialofficial o su @visitveronaofficial.
",https://www.visitverona.net/5-esperienze-da-fare-per-un-san-valentino-perfetto-a-verona/
143,COMPLEANNO A VERONA: 3+1 ESPERIENZE GRATUITE,"COMPLEANNO A VERONA: 3+1 ESPERIENZE GRATUITE 
ATTIVITÀ GRATIS PER FESTEGGIARE

La città di Verona rappresenta il luogo ideale per trascorrere dei momenti davvero indimenticabili, primo fra tutti è sicuramente il giorno del proprio compleanno. Noi di VisitVerona.net abbiamo selezionato 3+1 esperienze gratuite da fare in questo giorno speciale, siete pronti a scoprirle?

3+1 COSE GRATIS DA FARE IL GIORNO DEL PROPRIO COMPLEANNO
1I MOVIELAND: THE HOLLYWOOD PARK

Per gli amanti dell’adrenalina, un’opportunità da non perdere per festeggiare il proprio compleanno è una giornata al Movieland, parco divertimenti ispirato al mondo del cinema. Presentando semplicemente il documento d’identità alla cassa, potrete accedere gratuitamente al suo interno nel giorno del vostro compleanno. Per ulteriori dettagli, visitate il sito!
MOVIELAND

2I EFFUGIO: ROOM ESCAPE GAME

Se invece desiderate mettervi alla prova, potete scegliere di trascorrere il vostro giorno speciale da Effugio. Si tratta di un’escape room composta da 4 stanze davvero entusiasmanti, tra streghe di Salem, monaco oscuro, evasione nel far west e criminal mind sarà davvero difficile scegliere. Per ricevere un ingresso gratuito il festeggiato dovrà presentare un documento d’identità e formare un gruppo di almeno 4 persone. Cliccate qui per saperne di più!
EFFUGIO

3I UCI CINEMAS

Film e pop corn in compagnia dei propri amici: il modo migliore per trascorrere un compleanno tra le comode poltrone di Uci Cinemas Verona. Per coloro che dispongono di una delle tre SKIN Ucicard, richiedibili gratuitamente online, oltre a super sconti e premi verrà regalato un biglietto in occasione del proprio compleanno. Visitate il sito per avere più informazioni!
UCI CINEMAS

+1I MODUS

Ad accontentare gli appassionati di teatro nel giorno del proprio compleanno contribuisce invece Modus, spazio culturale a Verona con proposte di teatro, concerti, cinema, incontri, letture, mostre e molto altro ancora. Il regalo che questa realtà vi farà è un ingresso, compreso nella settimana del vostro compleanno, che sarà gratuito per chi compie gli anni e a costo ridotto per i suoi amici. Basterà semplicemente prenotare uno spettacolo tra quelli previsti nel cartellone e farsi fare gli auguri una volta arrivati in biglietteria. Tutti i dettagli sul loro sito!
MODUS
E voi conoscete altre attività da fare gratuitamente nel giorno del proprio compleanno? 
Taggateci sui nostri profili social @veronasocialofficial e @visitveronaofficial nelle vostre stories e post di Instagram e Facebook condividendo con noi i vostri consigli!
Buon divertimento! 
",https://www.visitverona.net/compleanno-a-verona-31-esperienze-gratuite/
